,review_id,star_rating,text_original
8604,R1XSEXQFF2V70G,5,"Exactly What I was Looking for in a Classical Guitar I did not purchase this product from Amazon, but seeing as there was no feedback yet on this model, I wanted to add my two-cents worth.<br /><br />Aesthetically:  This is a beautiful guitar.  The attention to detail is meticulous.  The finish is clean and even, with no evidence of buildup in the sharp corners such as where the neck meets the body.  The grain of the wood shows beautifully. The white spruce on top has a clean, bright, fresh look to it. The mahogany on the back in sides has a \\""deep\\"" 3-dimensional grain with some light figuring, and an attractive red-amber hue. The 6-layer binding on the top is an especially tasteful touch, and is colored in with a subtle, understated scheme (I particularly like this one strip in the center that is colored to match the mahogany B/S, sandwiched between two white strips that match the hue of the top).  The rosette is an intricate, but not overwhelming mother of pearl and ebony inlay.  Overall, a pleasure to look at.<br /><br />Body/Neck Construction:  As mentioned before, the finish is even across the body.  This is a spruce-top model, with a fairly wide-grain to the spruce toward the edges.  Otherwise, the grain is straight and even.  Back and sides are of African Mahogany, which a Cordoba rep informs me comes from Gabon, and is not the \\""sapele\\"" mahogany (which is, in fact, an attractive and effective tonewood).  All woods used are solid, no laminate construction used in this model.  The neck is also a nicely figured african mahogany, and has an ebony fingerboard with just the slightest hints of a ligher grain through, so I don't think this was dyed.  The neck is not as thick as the traditional classical neck, which will make it an easier crossover instrument to those familiar with acoustic or electric guitars.  Nut width is about 52mm, which is standard for a classical guitar, though about 9mm wider than the typical acoustic guitar.  This guitar also follows the trend of introducing a truss rod to the classical guitar neck, which had been considered heretical until recently.  I consider this a welcome change, having had classical guitars with bowed necks, and the only option to repair them would have been very expensive (pull the fingerboard, plane the neck, add new fingerboard and frets. $$$).<br /><br />Tuners are gold-colored plating with ebony-colored knobs. The tuners operate smoothly, and tuning is very precise.<br /><br />Now for the meat and potatoes:  How does it sound?  Very nice, thank you.  This guitar has a RICH low end that is not overpowering.  Very well balanced across the entire range.  The treble end is very sweet, clear and singing, but not overly bright.  You can pull a sufficiently sharp \\""edge\\"" from the trebles if you hit it right, but is not as crisp as some other instruments I've played.  I personally like it, but some prefer a more brittle high end, which is not what this guitar delivers with the supplied Savarez Cristol HT strings.  I am looking forward to trying it out with some carbon fiber trebles in the near future.  Overall, I would describe the tone as warm and sweet, without becoming \\""mushy\\"".  Individual notes are well defined.  Again, as you work your way up the neck, the trebles have a clear, soft sweetness to them, although you can still extract a sound with a sharper attack with the right technique.  The guitar is fairly loud, but not \\""concert level\\"", although I hope this will improve as the spruce opens up over time.<br /><br />If you are used to cedar tops, the spruce tops take a little getting used to.  Debates rage on and on about spruce vs. cedar, and the exact qualities of the sound of either top depends greatly on the guitar's construction, especially how the top in thinned, tuned, and braced.  That said, my favorite guitars have been the spruce tops, couldn't explain exactly why. However, if you like the \\""spruce sound\\"", this guitar delivers.  I haven't been able to compare it directly to the C10 in spruce, though recordings and videos Ihave seen suggest the C10 may have a bit of a harder tone to it, likely because of the solid rosewood B/S.  Some have opined that Spruce pairs best with rosewood, but I think this is subjective.  The spruce/mahogany combination in the C9 SP/MH yields a beautiful, expressive tone that should please a great many people."
4955,R77IC6U0F7CN2,5,"very good working stuff ! that item would be as my recomendation for using by string players ! any  violin player and restorer must to have this helper ! great working  resolt,economical,unvisible !"
5148,RNK9QJVIZC59O,5,PERFECT This Mixer is perfect for Karaoke and Dance Music provides a great sound which I love.  This is my second purchase upgraded one of my other mixers for this one
1430,R1VGEWCROR72XM,5,"I love my mic I love this mic, it is amazing. I have yet to really use it for serious work. But I have played around with it, with my friends. It is easy to use, easy to set up. It came in excellent condition and all the things that was listed were included when it arrived. I would recommend this product to anyone who loves music or making youtube videos."
6476,R4VG44QTRWJD0,4,"Good solid case I ordered one of these to fit an old Gibson LG-3. Another reviewer said his LG-3 fit this case, so I took the chance on it. Several other cases on Amazon do not post the internal dimensions, so I could not figure out what case would fit my old Gibson small-body. This case arrived quickly, and I was very impressed with it's quality. The case fit the intended guitar fantastically! The case also has a lockable latch, like 98% of all other cases. I am quite happy with mine."
3014,R1CA78O7PUDK6W,5,"Wow awesome little gizmo What a great way to store a few picks and have them at the ready when you drop them. Filled it up with a few picks, peeled the paper off the adhesive, stuck it to the back of the guitar and good-to-go. Great little product!"
3847,R3VD7HU8O98M98,4,Devices for making sound with a stringed instrument These guitar picks make sound when you use them to pluck your strings.
7388,R24ON3V9DZ0H8H,4,Four Stars Works good folds up nicely
6223,R388O2NAUIYY74,1,"Small and uncomfortable The title says it all. One thing you need to look out for: in the event you want to return this item because it is small and uncomfortable, do not order it from \\""The Music Superstore.\\"" They first refused to issue a refund even though I only had the item 2 days, and then they wanted to charge a 20% restocking fee. Beware!!"
6812,R2O7MJEKS0SVQC,4,"good sound good sound, easy to use, just pat your foot in time to music.  would have gave 5 stars, but the pins that hold the metal disks in are loose, I keep pushing them back in, maybe a little glue on the end will help. otherwise, good product, will buy again, one for each foot.<br />UPDATE, I put a piece of duct tape over the pins and have played several times and the pins have stayed in place, so if you order this, put duct tape over the pins to hold them in otherwise they are likely to come out and the jingles will fall out and go rolling across the floor.  this happened to me before I fixed it with duct tape. Still a good buy and great product"
3202,RTLMCWC2T9Y07,4,"Neerly perfect for the money and  my needs I am using a hackintosh which is the macintosh OS on a pc. So I needed a good sound card for my pro audio software. This Firebox sounds great. It is loud without distorting. It is so easy to get at all of the knobs and it was picked up with no problems by the Mac os. I did have to load the latest drivers in order to get sync.     I would have given it 5 stars but unfortunately since it is a small box, it not rack mounted. Well the 1/4\\"" input plugs on the front are too tight on my unit so it requires a great deal of force in order to get them out.    This is something I'm willing to overlook unless it later becomes a problem.    I would definitely recommend this product. I just wish protools would enable this product like they do with the m audio. I read mixed reviews on the m audio so I got this instead. So I just use logic and reason."
6266,R1RXGA06AFEW23,5,"My new favorite After trying many different brands and models of harmonica I have finally found the one that works best for me.  Very airtight and nice responsive reeds.  Plays well at all volume levels, bends easily and consistently.  I find it very comfortable in both mouth and hand, haven't had a problem with any sharp edges myself and found it near perfect out of the box."
1149,R5HNRIHHDB3AL,4,"Cheap practical stand Very reasonable priced for a music stand, and build quality is pretty good too. Some people may find it too short, but thats only if you are like over 6 feet tall. Otherwise, you will be okay with this stand's height."
2644,R2JOQ7YMY04AR5,3,"Defective pieces and bad customer service It has been over a week since I bought this stool I have since called Gibson once and emailed him twice and is still not done the pieces I need for the stool to be put together properly. May have to contact seller but feels bad as it's not his/her fault but not sure what to do.  Otherwise stool seems good, is pretty and seems like it will get wrinkly over time."
7516,R1ZIXFBK2WG5YH,5,"great Cable Fits tight, very easy to move around not to stiff."
4474,R3A7MRDFCYVU5M,5,This is the pad saver you want. Very good pad-saver. Durable plastic and soft absorbent and fibers
6581,R13TH1TJK3C87W,5,"Price to Performance Ratio Is Through The Roof Ranging from $110 to $150 ($200 on the manufacturer's website, but that is a bit too highly priced) these are extremely satisfactory for the price. At this price range I haven't found a single headphone that is almost perfect except for these. They are highly durable, stylish, comfortable, and most importantly sound very good. Out of the box and a few days after, I can say that I wasn't too impressed, but coming from regular Apple in-ears I didn't know what to look for or what good sound actually was. Now after spending 2 weeks with these (listening frequently) I can confidently say they are amazing and easily achieve top-tier status for their price. I also compared these with other Beats By Dre models and I almost immediately came to appreciate these for what they were. These don't have a bone-rattling QUANTITY of bass, but they have a clear, sufficient, punchy and detailed range of bass from the high hitting beats to the pounding of drums and even low, rumbly frequencies that Beats can't even achieve because of the low-end roll-off. Vocals come in not sounding right next to you, but maybe as though you were a few rows back in a concert. Instruments and treble and high parts of the song are crystal clear, they  aren't fatiguing to listen to, and I find it highly detailed. I found large amounts of bass fatiguing to listen to after about an hour so I appreciate the somewhat flatter response of these where the bass hits home just right. Give these a while and you will come to love them."
2888,R32PU43NOGJQCQ,5,Five Stars Worked perfectly
7840,R1KOHO2BXV8QWP,5,A deep full sound This was an excellent buy! It has a mid-low full sound that's perfect for any space. It sounds... perfect. I would recommend this Djembe anytime.
3315,R3718JQ6TEPXOW,5,Five Stars Exactly what I was looking for at a great price!
3779,RVQV051EMCC4W,5,Just what I needed This pedal rules.  Works perfectly and has a nice grip for carpeted floors.  I highly recommend it for other pianists or those learning to become one.
5793,RDICFH3NA9YFX,5,"The Secret Weapon against unwanted noise The ISP G String Decimator is, first of all, appropriately NAMED. It truly decimates unwanted guitar noise.<br /><br />Before I bought mine, I watched A/B-type comparison videos on YouTube and found this one to be the best: [...] It's narrated in Spanish or Portugese, but don't let that deter you... his captions are spot-on. The most powerful part of the video is how he demonstrates, without argument, how the Decimator does NOT decay or clamp the natural resonance of the sounds you want to hear.<br /><br />This pedal will never come off of my pedal board. That, however, does not mean I have it on all the time.<br /><br />I don't play with tons of distortion, but I do play combinations of single-coil, P-90 and humbucking guitars and this pedal is like a waiter in a fine restaurant... ready to serve you, but never in the way. I have the MXR Fullbore Metal pedal with what is supposed to be a noise gate built in, and the controls for the MXR are complicated by comparison to the Decimator.<br /><br />The Decimator simply rolls ON or OFF the noise reduction that is required without complicated knobs and/or settings.<br /><br />I'm not smart enough to use modeling amps and pedals that try to do too much (e.g. Fullbore Metal) have too high a \\""hassle-factor\\"" for me.<br /><br />The G-String Decimator does require you to learn about the best way to properly use it in your rig. WITH Effects (FX) loop *OR* direct to the amp's front input, it does a splendid job.<br /><br />*FRUSTRATION WARNING AND A HELPFUL HINT*... print the page from ISP or other helpful set-up images that folks have posted and sit with your board, patiently until you have the order worked out.And have some extra patch cables (and some longer than you're used to using) to get your board situated. Granted, that input is colored from my own experience... I used extra instrument cables to get me by until I could order longer patch cables.<br /><br />Some helpful links:<br /><br />From ISP:<br />[...]<br /><br />Forum-based link:<br />[...]<br /><br />Go to the video (if links are allowed) or go to Yoo Toob and search \\""g string decimator\\"" by \\""hermeticoguitar\\"". YOU WILL SAVE A TON OF TIME by doing so; and you'll realize that he did the video exactly correctly.<br /><br />So much can be said about this pedal, that I'd be waxing on here without any reason if you see the video for yourself.<br /><br />Bottom line: No other pedal delivers what this pedal delivers because of the way the pedal isolates the guitar.<br /><br />A top performer. Expensive? That depends on how much you value frittering time away on other solutions whose price is lower.<br /><br />Hear what this pedal can do ONE TIME and you'll find yourself selling other gear to fund this purchase.<br /><br />\m/ ROCK ON!"
7843,R1Z5K9EQI3MTSZ,4,"Very pleased with this piano I have now owned this piano for about 3 weeks and am very happy with it.  I learnt piano for about 10 years as a kid, then continued playing as a hobby until about 20 years ago when I sold my upright piano. Now, having decided to take up the piano again, I was immediately impressed with the sound and feel of this piano. While you can't really say that it sounds and feels 100%like a modern acoustic piano, it's still far better than any second hand acoustic piano that I have ever owned in the past. My only criticism of the sound, is that it's 2 x 6 watt speakers aren't really large enough, so the volume needs to be wound up to 100% to obtain acceptable sound across the complete range of keys, however as 90% of my playing has been through good quality headphones, this hasn't been a major problem. The sound through the headphones is excellent and you forget that you have headphones on after a while.<br /><br />I chose Yamaha mainly owing to their consistently good reviews, particularly with respect to authentic sound and key action & feel. The YDP-141 is a nice piece of furniture in any room and comes with a matching Yamaha bench and built-in keyboard cover.<br /><br />As other reviewers have said, the boxed package is heavy. I was only just able to transport it home in the back of our SUV and with the aid of a trolley, was only just able to lug it up a flight of stairs by myself. It assembled easily but I'd recommend getting someone to assist holding the keyboard section when it is being assembled and attached to the base. Once assembled, it can be moved around fairly easily but it's a job for two people.<br /><br />It comes with \\""bells and whistles\\"" such as 6 voices, metronome, ability to record and play back your performances, 50 in-built songs, MIDI ports, etc, but while these features are impressive on paper or in the showroom, they are quickly forgotten. What really counts is that it performs it's core functions very well."
8357,R3CU3S6R6OKSJ7,5,It's great! I've been using a voice processor for several months now. This one allows you to adjust your guitar tone/effects separately from the vocal effects. It's great!
5896,R20X5TJ8V0NO8,4,"Scary to apply! These peg drops definitely work, but it is scary to use them!  When you apply a drop to your peg, it feels like it fuses to the hole, and I panicked when that happened and thought I had destroyed my violin and the ability to tune it.  I rubbed some of it off with a wet q-tip, but that didn't help, and so I gave up and walked away.  Then I came back about 30 mins later, and at that point I was able to turn the peg (although it was still quite difficult).  So just a warning, they work but once applied it makes the peg very difficult to turn.  The violin does stay in tune though!"
6874,R2ZYT1JVTQWS1W,5,"Really Good! Because my old flute case broke, I had to get another. This is a perfect replacement and it is more portable and less fragile."
2753,R25RRH18FQKZ0C,4,"Comparable to Neutrik I recently purchased several GLS Audio cables based on previous reviews. So I gave them a try and I am well pleased. Good quality and all the solder points were perfect. The 1/4\\"" are comparable to Swithcraft and the xlr connectors are comparable to Neutrik. In fact it looks like an exact copy except the internal strain relief is a white plastic instead of black. Solid, noise free, and easy to solder. I already have more in my cart for the next buying round. =)<br /><br />The only con I can possibly see is the the overall cable thickness. I wouldn't mind if they were just a tad thicker. But if you are like me that should not be a problem. I always take good care of my cables."
6186,R35YXO1N9CWCUC,1,Avoid it and save yourself headaches! [[VIDEOID:21682621]]Video review of the M-Audio Firewire 410 WATCH BEFORE YOU BUY![[ASIN:B0000TP588 M-Audio FireWire 410 4-In / 10-Out FireWire Mobile Recording Interface]]
6239,R373RX49W3DGIV,3,"They are good for the price They are good for the price, I although had a problem with one that was not drilled enough to pass the string through."
1287,R1JLQVBYLMYY14,1,One Star Total pick of junk and waste of money.
604,R2U6D1Z6O1ZSD6,5,Five Stars Simple to use.
1374,R3ES89DB1VNYVW,5,Exellent Guitar Shipping took a few days more than expected. Item recieved in great condition after shipping. :)  I am very proud of my purchase
6417,R38SLBLUU3E6Y5,4,Great little Piano I love this little piano.  My granddaughter and I are having a wonderful time playing it.  I am catching up from when I used to play and she is taking lessons.  It's a great bargain for someone who can't afford or have room for a large piano
6569,RTD3C8TI4KUQF,5,"Excellent bench, very well made Excellent bench, very well made. The walnut didn't match my decor but customer service responded very quickly and I was able to exchange it for the black.  The walnut looked more burgundy than walnut when I got it. And for some reason,  the black faux leather looks much more of a better quality, more authentic than the walnut.  Other than that the hardware and quality and comfort of the chair is excellent.  Highly recommended.  Have used this chair for few months now before posting this review."
927,R18P0FWQMV6Z0M,3,"Not a bad Option! Had these a few weeks along with others I bought and the jury is still out. Not as comfortable as other brands but offer protection, but clarity can get lost. Two levels offered is a nice touch."
7198,R3OA8424HEO8UU,4,Four Stars Most of the Songs doesn't have a vocals
6033,R2XPC1ULET5JVL,5,"Has stood the test of time & school bus commutes! My daughter has had hers for 5 years now. It has stood up to practice, bumps, and school bus commutes with little incident. We are definitely very happy with our purchase. We also have an LJHutchen trumpet and flute and have nothing but high praise for them all. Highly recommend!"
4848,R3T5VLWY7L0VKZ,3,"Does the job This compressor does the job well, very easy to control and very well build.  It ads gain when moving the attack knob above 12 and that's why it has only 3 stars.  In any other setting it sounds very well though. Reacts very well to my other pedals on the board.  The sustain is very good too."
6807,R1CJ9O325GSYES,5,"Stick with the good stuff Although Iâ€™m not a banjo player, as a musical instrument collector, I try to keep all my instruments in good shape and ready to play. Thatâ€™s why over the years, I've come to trust a number of Dâ€™Addario products, from ukulele strings and straps, to saxophone reeds, to guitar, and now, banjo strings. Their products are always made to the highest standard with the best materials, and packaged securely in an easy to use format. These banjo strings prove to be no exception.<br /><br />They are loop end strings and come pre-sorted in five envelopes inside the flat folded cardboard package. The packaging is advertised as corrosion resistant, and I believe it, as every string came out shiny and clean. The finish is excellent and they look great. If I could play a banjo, Iâ€™d tell you how they sound, but all I can say is, they are easy to string, easy to tune, and they sound lively and vibrant to a guy who canâ€™t do much if any pickinâ€™. (Iâ€™m good at grinninâ€™, though!) I believe these would make great strings for just about any non-professional banjo player, and probably would satisfy many pros as well, which is why I say that Dâ€™addario has lived up to its reputation and these banjo strings are worth five stars."
8546,R10WCM727RXNJR,5,Five Stars best quality bag out there
7415,RL7Z13Y5MVHWC,5,Five Stars extremely bright and cutting with a full body sound... [...]
637,R8LX0BXPJOE9Z,5,Perfect! I was a bit worried about the complaints It was receiving on the reviews about it not carrying the foam piece as pictured. Upon arrival I opened it eagerly to find just what I needed. Comes with a foam insert and the bottom has a cap that snaps on/off to hold the foam in. Looks like the sellers read the reviews and decided to fix the issue everyone was complaining about! For that I give them 5 stars.
2939,RAXCJCM2ZQB8S,4,"Why Crown XTi power amps are special This is the third Crown XTi power amp that I've bought. This particular one is rolling around on an A/V cart along with a video projector, a DVD player, a small mixing console, and a pair of EV ZX-1 speakers.    The two things that set XTI power amps apart is their light weight and their built-in DSP.     Yes, Crown XTI power amps sound good, but I think this is something that we should be able to just take for granted on in products from first tier pro sound manufacturers like Crown.     However, this kind of power (> 1 KW) in an 18 pound 2 RU pound package is a bit special. Most traditional pro sound power amps with this kind of power might weigh about twice as much. The convenience in terms of having to carry and man handle an amp goes way up when the weight goes under 20 pounds.     From the comments I read, very few people actually take advantage of the DSPs in Crown XTI power amps. Shame, shame! Fact is that a sound system implemented with XTi power amps typcially needs no speaker managment add-ons, no external crossovers, no external equalizers, no matter how complex. Each XTI has a zero-extra-cost field-programmable DSP-based self-management facility, including crossovers, equalizers, power limiting, and even bass synthesis.     I have an old Dell laptop that I've loaded with two free downloads one from Microsoft and one from Crown, that is my amplifier programmer. I just start the \\""Band Manager\\"" software, cable it up to the USB power on my XTi power amps, and I'm in the driver's seat. The GUI software \\""finds\\"" as many Xti amps as you have cabled up, up to 8. You can select the amp you want configure, and then the real fun starts. The various crossovers, limiters, and equalizers each have their own easy-to-use GUI. Mouse away!  Before you disconnect the software, be sure to lock out the front panel of the amp. If someone is going to mess with your adjustements, let them find their own laptop!    Here's a practcial situation. I love EV ZX series speakers, I'mmost of the way through owning a dozen of them. In my opinon the ZX-1 is the real honey of the line. They also weigh only 18 pounds, but they can take every watt that this XTi puts out and turn it into clean sound. Everybody who has worked with ZX-1s will tell you that as good as they sound all by themselves, they really sing if you can tailor their response to their environment. On stands? Hanging on the wall? Whatever. Speaker response curves are not a one-size-fits-all situation. Depending on your application, turning the midrange down a few dB, and kicking up the ends of the spectrum a bit can make them sound like they are far larger and heavier than they are. Enter the Xti power amp. The tools are all there. No casual user or operator can see anything to play with. The system belongs to you. Just bring your netbook or laptop. I wonder when Crown will come up with a iPad version of Band Manager..."
6232,R2023R0GJ2L7WV,1,Bone sock that only fits a flute Didn't fit anything but me flute
8647,RU7Y33SX8AUVI,5,"Five Stars Great item, worth the buy for starter Djembe players!"
