,review_id,star_rating,text_original
239,R1CLO5BUC615NI,1,"It stinks (literally) I have a big nose, so it probably gives me a better sense of smell than most, but the strap I received had a very strong chemical smell that made me nauseous. I tried airing it out outside when it wasn't raining, and in my garage, for a few days, but the smell wasn't going anywhere.  I had my brother give it a whiff and he said, &#34;yeah, this would bother me, and it's only going to get worse.&#34; I returned it to Music123. They didn't want to exchange it for another because they were afraid I'd just think another one stunk too.  I might try one of the polyester kind, but really wanted a strap that wouldn't slide around much (why I ordered the one with the suede backing)."
8589,R75BCET4XP4EV,3,"Bought this to use in my classroom for students to ... Bought this to use in my classroom for students to share their writing and/or for singing, etc. The microphone stopped working after a few months. I think the cord became loose, because sometimes you could wiggle it and it would work again, but that's hard to do when little kids are using it."
5627,RI27TZXLZ66PM,2,Blocks out too much sound. These blocked out too much sound compared to another brand we use on a regular basis. They also are bigger and didn't stay in ears very well. I retuned them for these reasons.
8086,R2QJN73TWEDRSI,5,"Cakewalk UA-1G USB Audio Interface with iMac I'm certainly not a heavy-duty user in the world of computer audio but I have been looking for an affordable way to transfer a large collection of RDAT tapes into my iMac and do some cleaning plus other housekeeping on the transferred tracks.  I have been using the Cakewalk UA-1G USB Audio Interface for about a month and it is everything I need it to be.  When this project is done I will attach it to the output of my preamp and then download some LPs that never showed up on CD.  By the way, I use the Cakewalk with Audacity which is a free downloadable audio program and have had no problems at all.  Audacity will output just about any file format and I find it ideal for making wav, flac or mp3 files.  This in combination with Roxio Toast has the whole job covered from initial transfer to CD burn."
6615,R2KVBZ5548RRRZ,5,Five Stars Great product and delivery!
538,R2VDUKO0CTMTSF,5,"Be Carefull AC vrs DC My mistake,. but an easy one to make,. this is a 9v \\""AC\\"" power converter,. not a 9v DC power converter. if you need 9v DC,. do not get this one,. This really is just for powering one specific piece of guitar hardware that uses AC power.<br /><br />With that said, I hooked this up to a multimeter to see what it puts out and all stats are as advertised (5 stars for that as my reading mistake is not the products fault), though I have no idea where I'll ever have use for 9v AC,..."
7055,R13F6MXSOVMHO6,1,Wont stay Stay in position oh you wont dam fck u
1156,R1LT3MCDTA55E8,4,"Words great, needs a longer cord, and a different name. I bought this product used thinking it was a Voodoo Labs and I got a great deal.  Later, when I read more closely and realized its a total knockoff, I was disappointed I hadn't gotten the killer deal I thought initially, but I was pleased to see this unit works very well so far powering a few pedals at once.<br /><br />My 2 main complaints are the purposely misleading name, and the shorter than necessary power cord.  This thing absolutely requires an extension cord, even just hanging out around the house.  Aside from that this thing sounds much quieter so far than my 1spot adapter, and it doesnt have a daisychain of unused cables that short out against metal like the 1spot did."
8312,R1JCTTALW20AJV,5,Better than original Much smaller and better than orignal AC/DC adapther.
3341,R2O8991WPDGE8E,5,"fit and finish and set up (including intonation) were absolutely perfect right out of the box A couple of the pickup cover screws were not fully screwed down. Took all of two seconds to fix that. Otherwise, fit and finish and set up (including intonation) were absolutely perfect right out of the box. Note that I purchased another G&L a few months back and returned it for fit and finish problems. Conclusion, based on two samples, G&L quality control is a bit lacking.  Body wise, don't let the name fool you, this is a full size Fender tele clone, both as to the body shape and the 25.5 scale neck. The &#34;Jr.&#34; is a reference to a Gibson product, again, it should not be taken to mean this is an undersized or youth guitar. This does have 22 frets as opposed to the traditional tele 21 and the radius is 12 as opposed to 9.5. Still, think tele body and you won't be surprised. More accurately, think basic tele body because this thing has no fancy binding or fancy paint. In fact, from just two feet away, despite the color richness of the butterscotch headstock/neck and the â€˜mahogany reddishâ€™ of the mahogany,  itâ€™s a very basic, even stripped looking guitar, as the black pickups kind of disappear and the subtle beauty of the mahogany can only be appreciated up close. Very close.  Appearances aside, and in case you don't know tele's,  know you are getting a comfortable, easy to handle, easy to play guitar. This one, I would say, even a bit more comfortable and a bit easier to play because of the lighter mahogany body and the 12 degree radius. That said, some complain the G&L's heavily glossed neck a bit slow. I donâ€™t have a problem with it but if you do you can always lightly sand/steel wool it to a faster satin finish, leaving the front of the headstock alone so as to retain the rich color and the G&L logos.  Sound wise, we have a whole other animal as this thing carries two beefed up clones of Gibson's storied P90 single coils.  In case you don't know P90's, understand that Gibson never really pulled off the single coil thing, that few if any P90's soundlike any Fender single coil. These are no exception. While you can dial in a decent representation of tele 'twang' at the top end, this guitar and these G&L P90's are best played as and described as 'punchy' mid range pieces.  Don't get me wrong, G&L did a great job of matching up the electronics on this guitar. You can dial up a nice sparkle to a very, very dark with practically no mud anywhere in the range. All with no hum or other extraneous noises. In other words, twisting the tone knob actually produces different useable tones, something that cannot be said for all guitars, regardless the price range.  So, this guitar is versatile, but in its own way, a P90 way. Not PAF, (true or the all too common in this price range â€œmuddyâ€ Epiphone PAF), not Telecaster twang or Strat quack, not Rickenbacker clean and chimey, not an ArtCore rich and bluesy.  Not EMG metal. Just a rich P90 punch, plain and simple, nicely balanced across the two pickups and potent enough to carry some gain.  Also note that the P90 flavor continues when you turn up the gain. Perhaps a little less rich, but it is definitely there. Understand, I donâ€™t use a lot of distortion nor a bunch of pedals so YMMV but to me this thing sounds as good under mild to medium distortion as anything I own, better than most, way, way better than some.  Finally, realize that this combination of tele clone and Gibson P90 clone is a bit unusual, although G&L has done it before, albeit at a much higher, limited edition, price range. In fact there has been some grumbling in G&L owner circles that this model  'devalued' their previously purchased â€˜collectorâ€™ P90/tele clones.  Finally, finally, note that I played the guitar through a variety of medium range amps. I didnâ€™t have any low end stuff available at the time and I donâ€™t own any high end, Mesa quality, or high end vintage stuff. It really liked my Blues Jr. III as well as a Roland GA112. Same for a Vox AC15c1. The only thing it didnâ€™t sound good with was a cheapo Marshall emulator head hooked to a 12&#34; Celestion 70/80  which, interestingly, I flat out love and which is my absolute favorite Strat amp.  So who needs one of these?  I personally would  recommend this to any beginner. In my opinion, this is a much better place to start than a Les Paul or a Tele or Strat or a shredder as it sounds good straight up. You donâ€™t need a fancy amp or dropped tunings or super accurate setups. Itâ€™s light enough you donâ€™t need a custom made six inch wide strap. No fancy controls, one tone, one volume.  Just pick it up and play it, the â€˜punchâ€™ will make you and your exercises sound better and sounding better may well keep you playing longer.  I would also recommend it to any experienced player wanting something fun to play and fun to listen to while plugging the hole between the PAF and tele/strat sounds. However, if â€˜plain janeâ€™ appearances bother you, you best pony up another grand or so for the USA limited edition."
1659,R1SLMQQHGZQNUG,3,"Dont last very long The sticks look very good, they sound very good on my drumset, but after a week or two of medium use one of the sticks bent."
3288,RWC05L6TO9OF3,4,"Good for metal amp pedals. This is a hi-gain amp, you canâ€™t get any sound without using the gain, raising the gain from minimal to 9 oâ€™clock gives you a little distorted sound, like maybe for hard blues, at 11o'clock you get an AC/DC sound, after 12'clock you are into metal territory, after 3 o'clock it gets really noisy.<br />Another thing comes when you plug a pedal, thatâ€™s other level, I have a RP 15 and it sounds WONDERFULL, everything from clean, blues, rock, metal, etc, sounds great, this amp was made for metal and it can handle every distorted pedal, soâ€¦it is a good valve amp, YES if are a metal head and NOT if you want a clean amp.<br />It is a good amp with pedals, no so great without them.<br />Another thingâ€¦.it is as heavy as a obliged marriageâ€¦.soâ€¦really heavy."
7340,R37CKNK0864DQD,5,Five Stars Received in time frame as expected
6968,R3KVPYITPVII9K,5,Five Stars Simple but wonderful pop filter.
1233,R20O58QBYK1RE1,5,Great product at 1/3 the price of others. Great product at 1/3 the price of others. For something heavier then a uke you will need to buy #10 anchors at wally world for .97 cents for a pack. I will be buying more soon.
7542,R3FAZN83B33D00,4,Four Stars Easy to handle. You can use it with one hand and it holds down the strings very well.
2008,R2IYA22S7UO2MZ,5,Worth every penny No problems so far. This works great! I use it for my led lights on my bicycle. Worth every penny.
7303,R2NUHP8PGKH93T,5,Great. Very good. Fathers day gift. Perfect. Thankyou.
1123,R2AG1XTOTWZWNI,5,Five Stars Safely stores cello
3090,R2C2YGC44TO49E,5,Very Nice Hanger ... This was a gift .. She was very happy with this nice hanger!
4715,R1SWH4NGZV0JEW,5,"DBZ Guitars Gets It Very Right I purchased this sight-unseen, and I was very happy when it arrived, almost in perfect tune and ready to play. The first thing my wife said is that it looked like a deadly Klingon weapon. It does look like a Bird of Prey in flight, with the ominous charcoal/striped/streaked body paint. This is my first ebony fret board, and I must say that it is very fast, as the description states. The Grover tuners are very smooth and solid. The head stock is nicely shaped, the frets are perfect, the string action is close, and the active EMG pickups are epic, as usual (I also own a 7-string Schecter with EMGs, also awesome!). The Original Floyd Rose is the best double-locking tremolo system available, and this one is no exception. The 3-way toggle clicks into place cleanly, better than any guitar I've owned. Same for the 1/4&#34; output. You hear the jack click into place. Plug it in and rock out!"
1729,R3O57T4F0OWC8C,5,Five Stars Run a little hard.  2.5 = 3.5 Vandoren
5665,ROA20IFJ2DUPJ,3,I recommend clear plastic stick on feet be placed on the ... This instrument stand will work with a piccolo trumpet but the plastic upright may need to be sanded to a smaller diameter to accommodate the trumpet bell flair and allow the bell to rest on the stand's plastic base.  I recommend clear plastic stick on feet be placed on the base to prevent scuffing of the bell.  The stand will place the trumpet close to the floor giving it good stability.
3207,RN9GN8X76TG14,5,Five Stars Again a fine product. Great tone and last a long time. Use them for studio work.
4680,R3RF379PZATCII,5,Love love love the case Love love love the case. Going to order one for my phone next. Heavy-duty and well worth the money.
6869,R328XACBVBFIXP,5,"Gold Standard of Guitar Strings. These are my favorite acoustic strings.  I really like the tone that they give, and it is valuable that they do not need to be changed out as often as most other strings.  They hold a tuning well.  I use these in my Taylor GS8, and I love the tone and volume of sound that they provide.  There are many fine guitar strings, of course, but I think that these are the gold standard to measure others by."
7790,R1SHWSROW9S8ZX,5,"GREAT VALUE I love my new headsets from JK. The double earpiece allows for me to move around a lot without worry of it falling off, and the sensitivity of the mic is great. Seems to be very durable as I am very rough on equipment. Great Value. I am actually ordering more for the group."
429,RZ0I8ZQQLL1PJ,2,Not practical I mean it works and all that but I was not impressed with it. It was cheap and didn't hurt the bank. I mean if your at a table reading music you really do not need this anyway.
3817,R1OFSGN9XO85IA,5,Sennheiser HD280 very nice quality. a bit heavy though. wish they had a straight cord. very nice sound. well worth the money.
5395,RK5J8VZXW29BJ,4,Good entry level guitar. This is a good deal for the beginning guitar player. The tuner is not great but for the price of the bundle you won't go wrong by purchasing this set.
2603,R2YSG8WD35BPU,4,"I like this guitar. Had been longing for a silent classical guitar for long, and when I saw this guitar on Amazon the first time, I decided to buy it. The delivery was quick and the guitar was in excellent condition.<br /><br />I like it because it serves all my purposes: ie practicing at night without disturbing my family, low cost, and good quality. The sound is good as well, of cause not good as regular classical guitar.<br /><br />One small defect: there are no fret markers. But I resolved it perfectly. I cut off some small round dots of duct tape by using a hole puncher (used to punch holes on belt), and stuck them on the near side of the fingerboard on to mark the frets.<br /><br />I recommend this guitar to all the classical guitar players if you want to practice guitar without disturbing others."
2683,RIT2N0D2IT142,5,Works Well I needed it form my Behringer  V-Tone Acoustic Driver pedal. It works.
6618,R2B22D1CL93A6K,1,"Dont buy this piece of crap Cheap, built backwards, to make it right had to take pins out and turn arms backwards. Im gonna put 12000 worth of vintage horns on this crap. I think not."
6836,R3P95JNZPN71UU,2,"poor construction.  missing parts. Wouldn't recommend this for anything with substantial weight.  Very shoddy construction, most of the screws didn't fit in to the bolts that came in the package."
2227,RVUIOW5ZQUT8M,2,"Squeeeeeeek, grooooooooan I bought these stands because they looked really nice, much better than Manhasset visually, and the reviews were good. However I was very disappointed upon the unboxing and end result of the product. With one of the stands there is a VERY loud groaning/squeaking sound and the second stand that I put together fell apart. This however allowed me to see the inside of the stand. the metal shaft is encased in two halves of rounded plastic in which are two very resistant springs, this is what keeps the shaft from falling down. However it is so tight that it makes the shaft difficult to move inside of the column creating a lot of resistance, therefore when you spin it, that resistance results in this vibrating squeaking. In my opinion this is a poor and cheap design, partially why they can be sold cheaper than Manhasset. If you have the money go for the Manhasset, if you expect to be needing to move the desk around rather than keeping it in a fixed position don't get this particular Hamilton. I would say these are great for a sturdy practice stand, however not for performance as the functionality of the product design is, well, crappy."
8664,R3AKWQPMMHM13R,5,"has all I need book comes with cd with cello and without cello over the piano accompaniment. It also comes with a piano score for a real piano player to use, which is the one thing I need for my instructor"
3755,R17ZI3JQYNWRIR,5,"Dat Synth Fun little unit. I love to make drone music, and this thing helps that right along. It is small, very small, it fits in my hand. Not a con, just don't expect a behemoth."
1513,R1FZ3E92FWDDIB,5,Five Stars Plays like American. Mexican in case you wanted to know
6670,R7GQR8VWF01CJ,5,Works better than the Roland pedal on my Casio keyboard. The Roland pedal would not work with my Casio keyboard.  This one works perfectly and feel great!  Good quality.
7626,RJMVRQGHYYQ8K,5,"worth every penny Great for beginners. Is not totally silent when played without an amp but is not loud enough to annoy the entire house. I recommend getting a new set of strings after becoming familiar with the instrument, the A string has a poor tonal quality. A tip for other beginners: Use small pieces of tape along the side of the neck to mark off notes with the help of a tuner. Also dont give up, its not an easy instrument to play but don't get frustrated and give up. Like any instrument, patience and practice are key. Beautiful and well worth the money."
2481,R2C056YLS2CEWW,5,Perfect! I bought this for my Juno G not long ago and it's perfect! I now have all the memory I need for saving samples and songs. A must have for songwriters and producers...    Cdrive [...]
1426,R2DMAYEUR5IN1H,4,"Watch for uneven UV fading... Works very well to protect against buckle rash, BUT, on both of my guitars I used this on, I experienced the gradual fading of the finish from UV on the unprotected part of the guitar, allowing the outline of the scratch pad to be quite visible.  So keep your guitars in the cases, not on a stand in the living room!"
3322,R3SAC9C9R945KS,5,Beautiful This is my first polymer (plastic) whistle and I would rank amongst my other whistles as one of my best!
6319,R222FCTP203UP,5,Great shelf - a little pricey but works great The holes/slots are nothing like the pictures. The shelf the was delivered for me was very perforated - lots of air movement possible. If you wanted a more solid shelf then this is not the one for you.
2648,R15WTV2YC0JWSB,5,Five Stars Thank you from Don
3977,R2C1NLTFWEPJ0H,5,"Travels well... I bought this for my daughter who was attending a summer music camp and needed a stand that traveled well. Our car was packed to the brim, but this fit nicely and it is also very sturdy, so it is now her everyday practice stand in her room.  It is easy to put together, break down, and reassemble.  You won't be disappointed."
540,R1FEU2N57R1L6R,5,Five Stars good price
3305,R31VBCT4M1T920,2,Two Stars It's too firm to sit
5046,R102D5JKXIJ0KI,4,"Four Stars Good quality, light weight.  Love it"
8628,R1FB4G7U1Y4NJP,5,Very happy with this light Very happy with this light.  I am using it for my knitting and am able to take it anywhere I am sitting.
8270,R19QAMY7DYOGIU,4,"This tuner does everything I want it to. I use this tuner on several bass guitars, some with alternative tunings and it works great. I'll probably buy more of these because they are so convenient."
6151,R1DQVNMHVKL17Q,5,Five Stars I really liked the sound. Good product
6570,R1LSW56ZVUHCMF,5,"Great quality for low price We use these audio recorders for our undergraduate art program because they are cheap and still get the job done. The casing over the micro-SD card is a little flimsy, so we put tape over it and instructed the students to only move files on/off the recorder with the USB cord (works great!)."
185,R2EZRAMZSTQAKH,5,Good Product Use for church services. Didnt have a big budget but didnt need it. This product works great for what we use it for at a great price. Maybe not great for a rock & roll show but perfect for us. Fast shipping. Product as advertised. Would buy again.
7095,R1XL05AGWLE2I6,5,very solid mic.. worth spending the extra money ... very solid mic .. worth spending the extra money to get this one vs another cheaper mic that i bought and just fell apart a few days later cause the kids dropped it .. i know they should not drop the mic's but  worth getting something that can withstand the kids &#34;tough love&#34; .. this one does well
3820,R1Y3P3YVVSEJBZ,5,"Small Guitar Hello, this is a great guitar for my 21 month old toddler. The size is perfect and the price was right!"
4960,RI31GB2XDG1SK,5,Five Stars Arrived in good time.  Color tone was good.  Very happy with it.
315,R1RGKZLY3ZXBP6,5,"Terrific Purchase This was a terrific purchase.  Thanks to the customer service people at Kenwood who recommended I replace my turntable with this Audio Technica turntable I am now able to play my 33 & a 1/3 and 45 rpm records on my five-component Kenwood stereo system I have had for 27 years.  Then turntable is easy to operate, looks good and fits right in.  Nice price too."
3210,R911TJ4C7N9V1,5,Five Stars Beautiful violin for $$ and sound.
304,R395INQ0PI40U6,5,"Exactly what I was looking for! I have a Mackie Profx8 and this was exactly what I was looking for.  The build quality looks and feels great.  All the components including zippers felt solid.  My mixer fit nice and snug with padding in all the right places.  I can't really complain about the price either, it is definitely worth it."
1022,R1H72XSZWL7RAI,3,"Three Stars Bought 5, one of them doesnt work"
8608,R3FLYZ74UGLPGR,2,"Bent Within minutes, 2 of the notes stopped working. I opened it up and was just an issue with some of the reeds being bent. It's working, and considering the price it's still likely a good deal - but having to open it up to fix causes a low score."
5564,R3KCATI2ZOFB5E,5,"Great Machine Heads I have used Sperzel locking machine heads in the past and give them high marks for quality and stability.  When looking for machine heads for a new project, I found that Sperzel offered the heads in a chrome finish in addition to the satin finishes.  They were easy to install and I am very pleased with the product."
3459,R14FQ6QYJJSRVR,4,"Meet my expectations Meet my expectations, very good quality and sound, of course for a fun home karaoke. I don't give the fifth star because one of the 9v batteries (the regular square ones) after 6 hours of very intensive Karaoke singing runs out of power, nothing that you can not solve with a regular alkaline battery. I bought this one rather than other cheaper models, because of the mixed output, for me it was important because my equipment only has one input. Cheers!"
3469,R1E24TS4GI3GVI,5,Great Gift! Got this for my daughter Christmas of 2007.  It is awesome and she loves it.  Especially useful b/c she can recharge her ipod!  Would buy and recommend again!
6961,REP3YEO2817DD,5,"BEST WASH / BANK LIGHTING SYSTEM I GOT ONE TO TRY OUT ,I GOT THIS ONE FROM SONIC ELECTRI OFF AMAZON THE LIGHT IS WELL BUILT ITS GREAT HAS ALL THE FEATURES DMX/STANDALONE ETC,GET THIS ONE IF U CAN IM FIXING TO ORDER MY SECOND ONE .GOT GIVE IT 5STARS BEST BUILT / BEST PRICE, CHAUVET LIGHT IS GREAT BUT THIS ONE IS BETTER BUILT AND BETTER PRICED.ALSO THIS LIGHT IS BRIGHTER THAN A LOT OF ONES I HAVE SEEN.up date well I got the second one you really need two of these lights there great and built very good ,they also come with nice traveling case lined with black velvet .getem if u can you will be glad you did"
2272,R1NJOJWH28LXBD,4,Nice! Exactly what we were looking for.  I wish it had a handle but otherwise great
7443,R2N4R4PZ87JF9Z,5,"I'm pretty sure Levy's Leather discontinued this strap I'm pretty sure Levy's Leather discontinued this strap, I wish they hadn't. It's my favorite strap. It was pretty hard to find the one I have. I had to get it used of Amazon."
1002,R24FAM65RTEO6C,5,Made a wonderful gift!!! I ordered this as a Christmas gift for my husband. He was beyond excited! He has now made dozens of picks and loves finding news things to punch from! Great product!
1835,R3IS0DZFWFXEMR,5,"$299?? This thing is absolutely incredible. I mean, truly. It's amazing. Everything you want and more. Tape crinkle? A knob to control how old your tape is that you're emulating? Versatile. Lots of praises to give this thing.<br /><br />But.... I do NOT know why it's listed as $484??? Buy it straight from the strymon site. It's only $299...."
2728,R2FRB46CA26QDO,5,I've owned much more expensive banjos I didn't like nearly as much as My Epi MB-100 I've owned much more expensive banjos I didn't like nearly as much as My Epi MB-100.  Definitely worth more than the selling price.
3463,R2BCXDVLHZ3CHY,2,Looked good! Never got to use it... Light bulb was broken on first and second attempt...<br />Maybe I should have thought twice before ordering something so fragile...
1992,R33T0HLR7TD27V,2,"I got what I paid for. This device doesn't work well with a 4-string bass plugged into it, as the \\""G\\"" setting doesn't recognize the open G string from my bass. It doesn't recognize the harmonic, either."
4191,R3U7T6VFVNT5Z8,5,Five Stars love them.  working perfectly
5741,RDS385P9LW1FX,5,Five Stars My favorite strings
